<?xml version="1.0" encoding="ISO-8859-1" standalone="no"?>
<!DOCTYPE database SYSTEM "../dtd/database.dtd">

<database name="quoting" identifierQuoting="true" defaultIdMethod="native" namespace="Propel\Tests\Quoting">
    <entity name="QuotingGroup">
        <field name="id" required="true" primaryKey="true" autoIncrement="true" type="INTEGER"/>
        <field name="title" type="VARCHAR" primaryString="true"/>
        <field name="by" type="VARCHAR" size="64"/>
        <field name="as" type="INTEGER" />
        <relation target="QuotingAuthor"/>
    </entity>
    <entity name="QuotingAuthor" identifierQuoting="false">
        <field name="id" required="true" primaryKey="true" autoIncrement="true" type="INTEGER"/>
        <field name="name" type="VARCHAR" primaryString="true"/>
        <relation target="QuotingAuthorType" />
    </entity>
    <entity name="QuotingAuthorType">
        <field name="id" required="true" primaryKey="true" autoIncrement="true" type="INTEGER"/>
        <field name="title" type="VARCHAR" primaryString="true"/>
    </entity>
</database>
