<?xml version="1.0" encoding="ISO-8859-1" standalone="no"?>
<!DOCTYPE database SYSTEM "../dtd/database.dtd">

<database package="core.review" name="bookstore" defaultIdMethod="native" namespace="Propel\Tests\BookstorePackaged">

  <entity name="Review" description="Book Review">
    <behavior name="auto_add_pk" />
    <field name="reviewed_by" required="true" type="VARCHAR" size="128" description="Reviewer Name"/>
    <field name="review_date" required="true" type="DATE" default="2001-01-01" description="Date of Review"/>
    <field name="recommended" required="true" type="BOOLEAN" description="Does reviewer recommend book?"/>
    <field name="status" type="VARCHAR" size="8" description="The status of this review."/>
    <field name="book_id" required="true" type="INTEGER" description="Book ID for this review"/>
    <relation target="Book" onDelete="CASCADE">
      <reference local="book_id" foreign="id"/>
    </relation>
  </entity>

</database>
