<?xml version="1.0" encoding="ISO-8859-1" standalone="no"?>
<!DOCTYPE database SYSTEM "../dtd/database.dtd">

<database package="core.book" name="bookstore" defaultIdMethod="native" namespace="Propel\Tests\BookstorePackaged">

  <!-- This table exists to explore/test the handling of BLOB/CLOB objects. -->
  <entity name="Media">
   <behavior name="auto_add_pk" />
    <field name="cover_image" type="BLOB" lazyLoad="true" description="The image of the book cover."/>
    <field name="excerpt" type="CLOB" lazyLoad="true" description="An excerpt from the book."/>
    <field name="book_id" required="true" type="INTEGER" description="Book ID for this media collection."/>
    <relation target="Book" onDelete="CASCADE">
        <reference local="book_id" foreign="id"/>
    </relation>
  </entity>

</database>
