<?xml version="1.0" encoding="ISO-8859-1" standalone="no"?>
<!DOCTYPE database SYSTEM "../dtd/database.dtd">

<database package="addon.club" name="bookstore" defaultIdMethod="native" namespace="Propel\Tests\BookstorePackaged">

  <!-- this table exists to test the many-to-many -->
  <entity name="BookClubList" description="Reading list for a book club.">
    <behavior name="auto_add_pk" />
    <field
      name="groupLeader"
      required="true"
      type="VARCHAR"
      size="100"
      description="The name of the teacher in charge of summer reading."/>
    <field
      name="theme"
      required="false"
      type="VARCHAR"
      size="50"
      description="The theme, if applicable, for the reading list."/>
  </entity>

  <entity name="BookListRel" description="Cross-reference table for many-to-many relationship between book rows and book_club_list rows.">
    <field name="bookId" primaryKey="true" type="INTEGER" description="Fkey to book.id"/>
    <field name="bookClubListId" primaryKey="true" type="INTEGER" description="Fkey to book_club_list.id"/>
    <relation target="Book" onDelete="CASCADE">
      <reference local="bookId" foreign="id"/>
    </relation>
    <relation target="BookClubList" onDelete="CASCADE">
      <reference local="bookClubListId" foreign="id"/>
    </relation>
  </entity>

</database>
